final_score,niche_score,niche_tag,channel_name,handle,sub_count,topic_overlap,matching_topics,note,sample_title_1,sample_title_2,sample_title_3,channel_id
91.67,88,programming-education,Fireship,@Fireship,4190000,6,"neovim configuration, terminal tmux setup, python design patterns, local llm coding, spark data processing, software engineering career",Massive dev education channel with regular AI coding tool reviews and terminal content,I finally found a use case for OpenClaw…,Claude just got another superpower...,Millions of WordPress sites just got hacked... again,UCsBjURrPoezykLs9EqgamOA
84.87,95,dev-tools,ThePrimeagen,@ThePrimeagen,541000,4,"neovim configuration, terminal tmux setup, dotfiles git workflow, software engineering career","Terminal power-user and Neovim evangelist, audience lives in CLI daily",Musician turned Programmer turned Musician,I was wrong btw,the worst man in tech,UC8ENHE5xdFSwx71u3fDH5Xw
78.58,96,dev-tools,Josean Martinez,@joseanmartinez,66900,3,"neovim configuration, terminal tmux setup, dotfiles git workflow",Linux and Neovim setup tutorials with direct OpenCode AI integration coverage,My New Arch + Hyprland Setup For Software Development,54 Essential Linux Commands You Need To Know,Are You Using The Wrong Terminal Shell?,UC_NZ6qLS9oJgsMKQhqAkg-w
78.09,94,dev-tools,DevOps Toolbox,@devopstoolbox,116000,3,"neovim configuration, terminal tmux setup, local llm coding",DevOps CLI tooling and AI coding workflows with strong terminal focus,"Cute, but powerful: meet Pi, a tiny agent",CMUX: Too Much Hype?,This S3 Alternative is INSANELY Lightweight (and 100% open source),UCYeiozh-4QwuC1sjgCmB92w
71.2,88,dev-tools,typecraft,@typecraft_dev,227000,2,"neovim configuration, terminal tmux setup",Linux terminal power-user content with bash automation and setup guides,You NEED to start using test containers!,This little machine is a BEAST,You've been browsing files wrong,UCo71RUe6DX4w-Vd47rFLXPg
70.34,95,dev-tools,TJ DeVries,@teej_dv,114000,1,neovim configuration,Neovim core contributor with terminal-centric developer workflow content,My official application for McDonald's CEO,my origin story,my best balatro run (ft ThePrimeagen),UCd3dNckv1Za2coSaHGHl5aA
69.8,92,dev-tools,linkarzu,@linkarzu,12300,2,"terminal tmux setup, dotfiles git workflow",Neovim and terminal emulator deep-dives for CLI power users,Why Showing Images in the Terminal Is a Mess,"Kitty Can Do This Now? Drag and Drop, Pixel Scrolling, More",Stop Reopening the Same Projects Every Day,UCrSIvbFncPSlK6AdwE2QboA
68.69,85,ai-ml-dev,AI LABS,@AILABS-393,131000,2,"terminal tmux setup, ai code testing",Claude Code and Anthropic-specific content with terminal workflow coverage,This Is The Anthropic Team's Greatest Advice,8 Vibe Coded Apps That Generated Millions Overnight,I Didn't Expect It To Work This Well,UCelfWQr9sXVMTvBzviPGlFw
68.6,72,programming-education,Tech With Tim,@TechWithTim,2000000,3,"python clean architecture, open source llm testing, software engineering career",Python tutorial channel with growing local LLM and AI agent content,Local Models Got a HUGE Upgrade - Full Guide (Ollama/OpenClaw),Hermes Agent Full Tutorial for Beginners | Setup Guide,Build an AI Email Assistant with Code | Full AI Tutorial,UC4JX40jDee_tINbkjycV4Sg
65.46,75,tech-commentary,The PrimeTime,@ThePrimeTimeagen,1100000,2,"python dependency injection, local llm coding",Tech commentary and dev culture from ThePrimeagen's alt channel,RollerCoaster Tycoon Optimizations are Insane,We are near peak hype,The Mythos Situation | TheStandup,UCUyeluBRhGPCW4rPe_UvBZQ
65.33,70,programming-education,freeCodeCamp.org,@freecodecamp,11600000,2,"spark data processing, pyspark data engineering",Massive free programming education covering Gemini CLI and Codex courses,Gemini CLI Essentials – Full Course,Sliding Window Algorithm for Tech Interviews - Full Course,3D Web Development with Blender and Three.js – Create a Cozy Café Portfolio,UC8butISFwT-Wl7EV0hUK0BQ
64.8,85,dev-tools,Bread on Penguins,@BreadOnPenguins,162000,1,neovim configuration,Shell scripting and terminal tool advocacy for Linux users,ㅤ,why processing in pure shell is worth it,I moved to Wayland :D,UCwHwDuNd9lCdA7chyyquDXw
64.66,45,tech-commentary,IBM Technology,@IBMTechnology,1660000,6,"local llm coding, ai agent workflow, ai code testing, open source llm testing, spark data processing, data pipelines airflow",Enterprise tech content with some AI agent coverage but heavily corporate,Apple’s new CEO & how AI understands intent,5 Podman Features You Should Know: Kubernetes & Containers Simplified,Should you let OpenClaw pen test your system? Plus: Cybersecurity for ephemeral software,UCKWaEZ-_VweaEx1j62do_vQ
64.55,90,dev-tools,CodeOps HQ,@CodeOpsHQ,13400,1,neovim configuration,Linux desktop and terminal deep-dives with Vim and Tmux focus,Stop Using Your Mouse: Vim Motions & Macros Explained,My Neovim Setup for 2026: The Ultimate Deep Dive,Build a Minimalist Linux Desktop with SwayWM – Part 3: Rofi Configuration (Line by Line),UCbdSso-vnvKjI6E2h_hDLFA
64.44,70,programming-education,Programming with Mosh,@programmingwithmosh,5030000,2,"python design patterns, ai code testing",Massive programming tutorial channel covering Claude Code and AI development,Claude Code Tutorial - Build Apps 10x Faster with AI,New Course Dropping Soon...,Top 5 Programming Languages to Learn in 2026 (to Actually Get Hired),UCWv7vMbMWH4-V0ZXdmDpPBA
63.38,88,ai-ml-dev,ZazenCodes,@ZazenCodes,13700,1,python clean architecture,AI coding tool comparison and agent skills across all major platforms,"How to Share Skills Between Claude Code, Codex, Cursor & GitHub Copilot",Gemma 4 Local Guide: Ollama + llama.cpp on MacBook Pro M4,Stop using AGENTS.md and CLAUDE.md (do this instead),UC4wbCxRPSrkbp5BNsNczbIQ
63.3,82,dev-tools,Dreams of Code,@dreamsofcode,205000,1,terminal tmux setup,Terminal tooling and Rust development with direct OpenClaw and AI coding coverage,Rust on the web is starting to look quite good.,"I finally found a solution for my token costs, one that won't last forever...",The weirdest programming language I ever learned,UCWQaM7SpSECp9FELz-cHzuQ
63.01,88,dev-tools,Henry Misc,@henrymisc,10300,1,neovim configuration,Terminal workflow and Neovim ergonomics for CLI developers,"10,000 Subscribers… What's Next? (Channel Update)",Stop Suffering Through Long Shell Commands,I Switched to iPhone After 14 Years on Android – Here's Why,UCgvpt0jhxyfTS_6AQ-AJBIw
62.85,78,programming-education,Eric Roby,@codingwithroby,37400,2,"python clean architecture, python dependency injection",Backend Python tutorials with heavy Claude Code and AI coding tool integration,Every Backend Developer Roadmap Is LYING To You!,You're a REPLACEABLE Backend Developer (here's how to fix it),9 Claude Code Features MOST Devs Still Aren’t Using!,UCFxwS8HIGH5_ut1fk0PNAHw
62.56,72,web-dev,Syntax,@syntaxfm,472000,2,"local llm coding, ai code testing",Web development podcast covering AI coding tools and vibe coding trends,Has AI melted our brains? Dev Cardio Challenge!,How to Fix Vibe Coding,Rating and Roasting Your Projects,UCyU5wkjgQYGRB0hIHMwm2Sg
61.71,75,programming-education,Corey Schafer,@coreyms,1520000,1,dotfiles git workflow,Premier Python tutorial channel with production-grade backend content,Python FastAPI Tutorial (Part 19): Deploy with Docker - Serverless Containers and Custom Domain,"Python FastAPI Tutorial (Part 18): Deploy to a VPS - Security, Nginx, SSL, and Custom Domain","Python FastAPI Tutorial (Part 17): Testing the API - Pytest, Fixtures, and Mocking External Services",UCCezIgC97PvUuR4_gbFUs5g
61.25,75,programming-education,NeetCode,@NeetCode,1070000,1,python design patterns,Coding interview prep with strong AI coding tool commentary,Anthropic thinks you're an idiot,Claude Code's entire source code was leaked,"Building the Future of coding, OpenCode with Dax Raad",UC_mYaQAE6-71rjSN6CeCA-g
60.31,85,dev-tools,Marco Peluso,@marco_peluso,5200,1,terminal tmux setup,Vim and tmux workflow deep-dives for terminal developers,Neovim + tmux clipboard not working? Here's why,Mise makes Neovim nightly effortless,Ditch Your Stash: Use Git Worktrees Instead,UCPIdAOR2dHuUGzADe7f3vnA
59.56,70,dev-tools,Brodie Robertson,@BrodieRobertson,119000,2,"terminal tmux setup, dotfiles git workflow",Linux and open-source news with terminal workflow mentions,The KDE Plasma Design That Never Got To Live,IPv8 Changes Everything We Know About IP,Github Hates That This Repo Still Exists,UCld68syR8Wi-GY_n4CaoJGA
59.45,78,dev-tools,Philomatics,@philomatics,67400,1,dotfiles git workflow,Git workflow and GitHub CLI with AI tool integration,You should probably switch to a monorepo,This AI Tool writes commit messages for you (and more),The Future of Programming with Patrick Dubroy | Philomatics Podcast #2,UCmtC7HJIoMQxkvV4gh5dP0Q
58.37,72,programming-education,NeuralNine,@NeuralNine,467000,1,python design patterns,Python AI tooling tutorials with Claude Code and agent skills,Reliable AI Research Assistant in Python: Langchain & MCP,Claude Code Crash Course: All Features You Need To Know About,Why I Don't Think SaaS Is Dead...,UC8wZnXYK_CGKlBcZp-GxYPA
58.1,70,ai-ml-dev,Zen van Riel,@zenvanriel,38700,2,"local llm coding, ai code testing",Local AI and WebGPU content with developer workflow focus,The Honest Guide To Fine-Tuning Local AI In 2026,I Quit My GitHub Job Because AI Breaks Software,I Replaced My AI Server With A Browser Tab (WebGPU 2026 Setup),UC7TUInmEJ4NmYb-krFz-SuA
57.32,65,devops-cloud,NetworkChuck,@NetworkChuck,5230000,1,terminal tmux setup,Massive cybersecurity channel with growing AI coding tool coverage,i didn't want to like this....,the WORST hack of 2026,OpenClaw......RIGHT NOW??? (it's not what you think),UC9x0AN7BWHpCDHSm9NiJFJQ
57.09,70,programming-education,CodeAesthetic,@CodeAesthetic,437000,1,python dependency injection,Code quality and design principles for all developers,Dear Functional Bros,"Dependency Injection, The Best Pattern",Premature Optimization,UCaSCt8s_4nfkRglWCvNSDrg
56.73,75,dev-tools,tony,@tony-btw,33100,1,neovim configuration,Linux system and terminal tool installations with developer focus,How to Install GNU Guix System (2027 Edition),How to Install OpenBSD (2027 Edition),XMPP is the End Game of Chat Protocols (2027 Edition),UC65_CVnMw6hvPET_DRDg3GA
56.18,65,ai-ml-dev,Digital Spaceport,@DigitalSpaceport,88600,2,"open source llm testing, model benchmark comparison",Local AI model benchmarking and open-source LLM testing,Qwen 3.6 27b Local Ai Review and Benchmark,Qwen 3.6 vs Gemma 4 Local Ai Benchmarking,Local Ai Performance Testing GLM 5.1,UCiaQzXI5528Il6r2NNkrkJA
55.84,65,programming-education,Next Day Video,@NextDayVideo,68500,2,"python design patterns, python clean architecture",Python conference channel with architecture and design patterns talks,To comment or not? A data-driven look at developer attitudes toward code comments,Lightning Talks,Free yourself from your ORM with mypy!,UCQ7dFBzZGlBvtU2hCecsBBg
54.31,60,dev-tools,devaslife,@devaslife,212000,2,"neovim configuration, terminal tmux setup",Cozy coding lifestyle with Neovim usage but more desk-setup and frontend focus,What a Japanese life principle taught me about overcoming AI fatigue,I made my Keychron K2 HE stealthy,I hacked a MagSafe stand for my iPad mini blogging setup,UC7yZ6keOGsvERMp2HaEbbXQ
54.1,78,dev-tools,Eric McKevitt,@ericmckevitt,1110,1,terminal tmux setup,Terminal customization and tmux workflow optimization,Completely Replace and Customize Your MacOS Menu Bar with Sketchybar,Tmux Popups - The Most Underrated Feature in Tmux,My RMPC Setup - The Best Terminal Music Player,UCnrclhptUG4nuYuYqgBzQMA
53.92,70,dev-tools,System Crafters,@SystemCrafters,38400,1,dotfiles git workflow,Guix and Nix system configuration with Git workflow for developers,A Primer on Match Expressions in Scheme - Learning Guile Scheme,Scraping Emacs Package Listings into SQLite - Real World Scheme Programming #2,Creating a New Website for Emacs Packages in Guile | Real World Scheme Programming,UCAiiOTio8Yu69c3XnR7nQBQ
53.86,55,python-data,codebasics,@codebasics,1500000,2,"spark data processing, data pipelines airflow",Data engineering education with some AI automation content,Our clients are saying No to Vibe Coding | Vibe Coding vs Manual Coding,Workflow Automation with Claude Code & Zapier MCP | AI Automation Project,About Codebasics AI Pro,UCh9nVJoWXmFb7sLApWGcLPQ
53.48,65,dev-tools,DistroTube,@DistroTube,275000,1,dotfiles git workflow,Linux distro and terminal tool reviews with some dev workflow,I'm Always Right And You're Always Wrong (A Message To Non-Idiots!),Non-Programmer Builds Web App In Minutes,Is Artix Linux Just A Protest Distro?,UCVls1GmFKf6WlTraIb_IaJg
53.24,70,dev-tools,Coding with Sphere,@codingwithsphere,22800,1,neovim configuration,Neovim and hardware setup for developers with C programming,My Experience Switching to a Split Keyboard (Corne V4),My Favorite Neovim Colorschemes,Stop coding so much,UCpwl7jNE9PJc-lBTShNs5TQ
52.83,65,programming-education,Let's Get Rusty,@letsgetrusty,167000,1,neovim configuration,Rust programming education with terminal usage but language-focused,Software jobs AI can’t replace,Top 4 Rust career paths (and which one you should choose),Rust Ruined My Career (I Can't Go Back),UCSp-OaMpsO8K0KkOqyBl7_w
52.42,50,python-data,Darshil Parmar,@DarshilParmar,203000,3,"spark data processing, data pipelines airflow, pyspark data engineering","Data engineering tutorials with Databricks and Spark, dev audience but no CLI tools",AWS Masterclass for Data Engineers with Project,Only Data Engineering Roadmap You Need 2026,Learn Databricks in 10 Minutes | Most Important Skill for Data Engineering,UCChmJrVa8kDg05JfCmxpLRw
52.24,60,programming-education,GOTO Conferences,@GOTO-,1060000,1,python clean architecture,Major tech conference channel with architecture talks,Tech Truth: Teaching Kids to Code with Sonic Pi • Sam Aaron & James Lewis • GOTO 2025,Kafka for Architects • Ekaterina Gorshkova & Viktor Gamov • GOTO 2026,Beyond Line Charts • Yao Yue • YOW! 2025,UCs_tLP3AiwYKwdUHpltJPuA
51.99,60,web-dev,Chai aur Code,@chaiaurcode,870000,1,python dependency injection,Indian web development education with AI and local tool coverage,We build a Hackathon Evaluation Engine with AI,My local AI software to process Youtube Videos,Control AI suggestions in VSCode,UCNQ6FEtztATuaVhZKCY28Yw
51.84,65,programming-education,bashbunni,@bashbunni,77600,1,dotfiles git workflow,Developer lifestyle and learning with terminal setup mentions,I've been worried about the future of open source... Is this the way forward?,The rust arc begins: my 90-day roadmap to grow as a developer,my deep focus classical music playlist // STUDY WITH ME (learning rust),UC9H0HzpKf5JlazkADWnW1Jw
51.32,70,dev-tools,Semicolon & Sons,@semicolonsons,5240,1,dotfiles git workflow,Vim and dotfile management with practical dev workflow,VIM A-Z: A Text Object for Every Letter in the Alphabet,How I organize my .vimrc and keep track what my vim is capable of.,How I manage my dotfiles with git,UC17mJJnvzAa_e9qQqLIfIeQ
51.25,68,ai-ml-dev,Samuel Gregory,@0x5am5,12400,1,dotfiles git workflow,Local AI setup and Claude tool coverage,MLX vs GGUF: Ultimate Comparison,Ultimate Guide Local AI Setup (Qwen3.6 + LlamaC++ + TurboQuant),M5 MacBook Pro: Qwen3.5 vs Gemma4,UCzeFD1by4aT8RxBwSR7IzDA
50.22,65,dev-tools,My Linux For Work,@mylinuxforwork,22500,1,dotfiles git workflow,"Linux distro and Hyprland setup tutorials, more ricing/setup than coding workflow",The Best of Both Worlds? Installing Cosmic + Hyprland on Arch Linux,ML4W OS 2.12.2: New Quickshell Selector & Major Script Upgrades,ML4W OS 2.12.0: The Quickshell Revolution!,UC0sUzmZ0CHvVCVrpRfGKZfw
50.2,72,dev-tools,GeekMasher,@GeekMasher,879,1,dotfiles git workflow,Neovim security integration and coding challenges with Rust,Building my own Object Relational Mapper (ORM) in Rust,Why do I use Neovim?,Using Neovim to Help Develop Secure Code - NeovimConf 2023,UC7e94PuJo_6tMxwx6BS7dzw
49.46,65,programming-education,DevTernity Conference,@DevTernity,12500,1,python clean architecture,Developer conference with Linux CLI and architecture talks,Mastering the Linux Command Line – Bert Jan Schrijver,🚀 Client-side Machine Learning (Nikhila Ravi ),Right and Responsibilities of a Delivery Team (Sandro Mancuso),UCvzMZyJZZ3XYQwbvOACVYrQ
49.36,60,programming-education,PYCON UK,@PyconUKSoc,4740,2,"python clean architecture, python dependency injection",UK Python conference with architecture and coding talks,"PYCON UK 2025: Ada by Emily Holyoake, a rehearsed reading","PYCON UK 2025: Bringing Randomness to Life: A Python tool for stochastic processes, Dialid Santiago","PYCON UK 2025: How to be a Python Icon, writing Pythonic Code, Jesse Carnaxide",UChA9XP_feY1-1oSy2L7acog
48.85,65,programming-education,PyCon Sweden,@PyConSweden,7850,1,python design patterns,Python conference with CLI interfaces and design pattern talks,Query your structured data with a LangChain AI agent  by Christophe Bornet | PyConSe | 2024,A challenge of converting a project's core to asyncio by Petr Savelyev | PyConSe | 2024,Accidentally popular: Beautiful CLI interfaces with rich-click by Phil Ewels| PyConSe | 2024,UCH_2cuWzFMyCPvm75lJJ6wg
48.57,50,python-data,Data with Zach,@EcZachly_,259000,2,"spark data processing, data pipelines airflow",Data engineering boot camp with some AI engineering comparisons,Building an Android and iOS app in one day with AI: Podcast Episode 1 - Li Yin - Founder of SylphAI,"Learn Data Modeling in 8 minutes: Dimensional Data Modeling, Data Vault, and One Big Table","Data Pipelines in 8 minutes: Streaming, Batch, and on-demand",UCAq9f7jFEA7Mtl3qOZy2h1A
47.69,55,devops-cloud,Wolfgang's Channel,@WolfgangsChannel,323000,1,dotfiles git workflow,"Homelab and self-hosting with NixOS, some terminal overlap",How to Build a Home Server in 2026 (without going insane),Searching for the Perfect All-SSD NAS,I tried (and failed) to ditch Spotify for an iPod,UCsnGwSIHyoYN0kiINAGUKxg
47.37,55,mobile-dev,Philipp Lackner,@PhilippLackner,252000,1,python dependency injection,Mobile development with some AI coding tool comparisons,I've Tried the New Claude Design Tool to Create a PL Coding App,Beginner Course for AI-Assisted Android Development,3 Theoretical Limits of AI - These Things Can't Be Fixed,UCKNTZMRHPLXfqlbdOI7mCkg
46.53,60,dev-tools,saneAspect,@saneAspect,13200,1,dotfiles git workflow,Terminal emulator and Linux desktop configuration,Ghostty: Is This the Future of Hyprland Terminals?,Stop Building Your Hyprland Setups in Your Head,Hyprland's Window Rules Explained,UC0qeRPC8H5c25yzGWQ-ffpw
45.34,48,python-data,Ease With Data,@easewithdata,54200,2,"spark data processing, pyspark data engineering",Databricks and data engineering tutorials with GenAI module for data engineers,GenAI - For Data Engineers Agenda & Introduction | LLM & Agentic AI | LangChain & LangGraph | Claude,54 Zerobus Ingest Lakeflow Standard Connector | Ingest Streaming data directly into Delta Table,53 Lakeflow Connect SQL Server Managed Connector | Ingest Data using Databricks native connectors,UCadVGkh-CrparnJIgmv5Iuw
45.13,50,python-data,coder2j,@coder2j,18400,2,"data pipelines airflow, pyspark data engineering",Data pipeline orchestration and some LangChain content,Why I Stopped Using pip (and What I Use Instead),LangChain Installation and Setup with OpenAI ChatGPT model | LangChain Tutorial P2,LangChain Introduction | LangChain Tutorial P1,UCHoLIMtg_OigNlJmjHX9J8Q
44.82,55,programming-education,EuroPython Conference,@EuroPythonConference,35700,1,python clean architecture,Python conference with community and technical talks,EP2026 - Ask Me Anything About CfP Workshop,PyStories with Numberly — Sébastien Crocquevieille,PyStories with Kiwi.com — Alena Osipova,UC98CzaYuFNAA_gOINFB0e4Q
43.6,55,programming-education,DevInsideYou,@DevInsideYou,13900,1,dotfiles git workflow,Scala and functional programming with some workflow content,I replaced most of Play3 and it worked!,Diamond Architecture - How to build HUMONGOUS Apps FAST! - Part 5 - Less Boilerplate Please,How we use sbt-buildinfo in production.,UCSBUwLT9zXhUalKfJrc2q2A
43.16,50,programming-education,CodeOpinion,@CodeOpinion,99700,1,python clean architecture,Software architecture commentary without hands-on CLI,"The ""Just Use Postgres"" Trap","Testable Code Doesn't Mean ""Interfaces Everywhere""","Why ""Clean Architecture"" is Killing Your Velocity",UC3RKA4vunFAfrfxiJhPEplw
43.01,40,python-data,Data with Baraa,@DataWithBaraa,361000,2,"spark data processing, pyspark data engineering","Data engineering and Power BI tutorials, less coding tool focused",What Are Databricks Notebooks? (Complete Beginner Guide),What I Actually Do as a Data Engineer,Pivot vs Unpivot in Power Query (Visually Explained) | #Power BI Course 13,UC8_RSKwbU1OmZWNEoLV1tQg
42.63,45,python-data,Afaque Ahmad,@afaqueahmad7117,27000,2,"spark data processing, pyspark data engineering",Data engineering interview prep and Databricks tutorials,"Databricks End-To-End Project | Zero-To-Expert | Streaming, AI, Lakeflow, Unity Catalog, AI/BI",How Much DSA Do You Need To Crack Data Engineering Interviews?,Will AI REPLACE Data Engineers?,UCYFKQl9VMvtnUHxZ9uFx7qw
42.41,55,programming-education,Interview Simplified,@sweetcodey,5580,1,python design patterns,Interview prep with some GitHub Copilot and design patterns,OTP Service System Design | How One-Time Password Verification Works,Inheritance in Python Explained with Examples | OOPS Mastery,Objects & Classes in Python — Explained Like You’ve Never Seen BeforeWhy this works,UC4x5_7OHwc1jNBZIVXw8HLA
41.82,55,programming-education,"Speak, Machine",@speakmachinex,3550,1,neovim configuration,Programming philosophy and junior dev content with light terminal mentions,Making Mistakes Is How We Learn as Developers,Why I (Kinda) Open-Sourced My Sci-Fi Books on GitHub,Harry Potter Was a Vibe Coder,UCMkMs3Val6p1J6ZJe-TJ65Q
41.74,55,programming-education,Code Collider,@codecollider,3350,1,python clean architecture,FastAPI and Python backend tutorials,15 FastAPI Best Practices For Production,"How Python Async Libraries (httpx, aiofiles, etc.) Works?",Performance Benchmarks: Django vs FastAPI vs Flask,UCXKVnF3KeF1wm3zJnMbWgHQ
41.56,45,python-data,Databricks For Professionals,@Emil-Kaminski,11900,2,"spark data processing, pyspark data engineering",Databricks-specific data engineering tutorials,Databricks Unity Catalog Tutorial - Data Governance made easy,Databricks architecture  - how it really works,Delta Lake - EXPLAINED - Full Tutorial,UC1-u_2nI97cNHtu_FQ3HP_A
40.22,50,dev-tools,Tech Pills,@TechPillsNet,10400,1,dotfiles git workflow,Linux hardware and dotfiles with light dev relevance,VR on Linux: my experience,How to flash OS images on the Pinephone (SD or eMMC),My experience with the Pinephone,UCVqlDOUyIjMWqBUhp73a90g
40.07,50,programming-education,code::dive conference,@codediveconference,9280,1,python design patterns,C++ and systems programming conference talks,Timur Doumler - code::dive 2025 interview,Maja Bartosik - code::dive 2025 interview,Lieven De Cock - code::dive 2025 interview,UCU0Rt8VHO5-YNQXwIjkf-1g
39.71,50,tech-commentary,The Rad Lectures,@theradlectures,7020,1,neovim configuration,Mixed tech commentary with one CLI project but mostly non-dev topics,The Dollar Is Failing - Here's What Comes Next,"Stop Using ls, cat and cd",We Have Passed Peak Tech,UCt7AzHv_-ECbPPF3zsm3BLg
39.34,55,programming-education,Python Space,@python_space,531,1,python clean architecture,Python architecture talks and community content,Clean Architectures in Python  presented by Leonardo Giordani,Is DevOps dead  | Embrace platform engineering,Python Quiz #2 Global and Local Variables in Python #python,UCeJ97dyGros9qt9I0MK1vAQ
39.2,55,dev-tools,TUX: Geek-Room from Raven2cz,@geek-room,476,1,dotfiles git workflow,Local AI stack and Git configuration mixed with gaming content,Gemma 4 + Whisper + Chatterbox TTS - A Fully Local Czech AI Stack,SomeWM - Tag Slide Animation - Coming Soon...,Somewm FX Feature - coming soon...,UCEzmvag90vo5gmxi-svedGA
38.63,50,programming-education,CodeTekTeach,@CodeTekTeach,3070,1,python design patterns,Broad beginner Python tutorial channel,The Complete Python Hacking Course Beginner to Advanced,Python SOLID Principles and Top Design Patterns,Mastering OpenAI Python APIs Unleash ChatGPT and GPT4,UCyJgUaFffGg9pTlM1GzgWQg
37.75,40,programming-education,Milan Jovanović,@MilanJovanovicTech,157000,1,python clean architecture,.NET backend architecture without terminal or AI tools,The Pipeline Pattern: Clean Up Your Complex Business Rules,The Easiest Way to Implement the Outbox and Inbox Pattern in .NET!,Monitoring .NET APIs and Microservices for Free (Uptime Kuma),UCC_dVe-RI-vgCZfls06mDZQ
37.18,35,devops-cloud,HackerSploit,@HackerSploit,1010000,1,terminal tmux setup,Pure cybersecurity offensive content without dev tool relevance,How FIN6 Exfiltrates Files Over FTP,Emulating FIN6 - Active Directory Enumeration Made EASY,The SECRET to Embedding Metasploit Payloads in VBA Macros,UC0ZTPkdxlAKf-V33tqXwi3Q
37.17,55,dev-tools,Robin Bowes,@robinbowes,23,1,terminal tmux setup,Minimal terminal content mixed with personal videos,"Alanis Morissette, O2 Arena London, Sunday 27 July, 2025","I 'ate you, Butler!","Look North - York City vs. Oxford United, Wembley, 16th May 2010",UCNsuuiKSAKUwzm3D-neEcCQ
36.84,40,mobile-dev,Cheezy Code,@CheezyCode,77700,1,python dependency injection,Android development in Hindi with design patterns,WorkManager Android Tutorial | WorkManager vs. Services | CheezyCode,Android Dynamic Notification with Foreground Service | CheezyCode | Hindi,Android Foreground Service Tutorial | CheezyCode | Hindi,UCOknqk-MSOCf3SANW8Wumfg
