final_score,niche_score,niche_tag,channel_name,handle,sub_count,topic_overlap,matching_topics,note,sample_title_1,sample_title_2,sample_title_3,channel_id
36.5,40,programming-education,Amichai Mantinband,@amantinband,60100,1,python clean architecture,.NET-focused tutorials with design patterns,The Best (and Free) Screen Annotation Tool for macOS,Introducing bananotate 3.0,3 Powerful Design Patterns You Should Know,UClz49zOCnzsclUJY-t62lIw
31.68,40,programming-education,Hallow Teaches Stuff,@HallowTeachesStuff,1480,1,python design patterns,Competitive programming solutions in Python,617A | Elephant | Codeforces Python Solutions | Explanation + Walkthrough,734A | Anton and Danik | Codeforces Python Solutions | Explanation + Walkthrough,791A | Bear and Big Brother | Codeforces Python Solutions | Explanation + Walkthrough,UC9ifFbkRguXk5hKCAjLsxIQ
30.44,35,programming-education,miss google,@missgoogle_07,5740,1,python design patterns,Broad beginner programming tutorials without terminal focus,Build a Web App with Vanilla JavaScript and Web Components,Selenium Automation Testing for beginners | Selenium Automation with Java,Rust Programming Language | What's unique about Rust,UCliErJMz_UnoeCBUWqwFWpQ
30.02,35,programming-education,Mark Inman,@Mark-D-Inman,4160,1,python clean architecture,Blazor and Microsoft stack tutorials,Handle Errors in Blazor the Right Way,13 Awesome features you didn’t know Visual Studio had,Image Dropdown List with Blazor,UCxd9eggS8qe5DPpYFeoZDxg
24.99,30,off-topic,Yeti LLC,@YetiLLC,872,1,python clean architecture,No-code and hackathon content without terminal dev tools,2025: Yeti's Year in Review,"Building a Nonprofit with Sky's the Limit CEO, Bo Ghirardelli",Vibecoding 2025: Lessons Learned During Yeti's 2025 AI Hackathon,UCqxrn5CGalpGyp1nj_G6HaQ
